{"validation_id":"prv-collab-v2-role-free-governance","issue_id":"collab-v2-role-free-governance","module_id":"core","fix_candidate_id":"fc-collab-v2-role-free-governance","candidate_commit":"665acc7117cdd99793cbe281c8992a52956e8d1c","candidate_tree_hash":"67fb913d159d8b10cd05c9f6faeac68fc30b23b5","artifact_hash":"sha256:33eb22542d22b8c0847cb29f94b09724e0b2d347a895addb88346c3f617c31c2","whitebox_producer":{"adapter":"cargo-test+node-test+architecture-gate","identity":"codex-desktop-single-worker"},"whitebox_evidence_ids":["ev-whitebox-v2-role-free"],"blackbox_evidence_ids":["ev-blackbox-v2-role-free"],"deployment":{"environment_id":"isolated-v2-install-20260830","install_receipt_id":"ev-install-v2-role-free","restart_receipt_id":"ev-restart-v2-role-free","entrypoint":"generated/modules/core/lib/core-daemon","producer":{"adapter":"daemon-lifecycle-test","identity":"codex-desktop-single-worker"},"observed_at":"2026-08-30T16:54:00Z"},"source_unchanged":true,"result":"pass","created_at":"2026-08-30T16:55:00Z"}
